time,review_txt,stars_txt,ratings
2019-05-23,렉이 걸려 삭제했다가 다시 하려는데 복구나 연동이 안되네요,별표 5개 만점에 2개를 받았습니다.,2
2019-05-29,나쁘지 않은 퀄인 듯~~~~사운드가 좋네~~,별표 5개 만점에 5개를 받았습니다.,5
2019-05-30,설명하기 힘든 흡입력이 있는 게임 중독됨ㅋ 놓지를 못함...,별표 5개 만점에 5개를 받았습니다.,5
2019-06-01,몇 시간 플레이는 안했는데… 이 미 친렙업은 뭔가요 좋네요,별표 5개 만점에 5개를 받았습니다.,5
2019-05-21,게임 완성도도 괜찮네요~ 그 외 다른 점도 다 만족입니다,별표 5개 만점에 5개를 받았습니다.,5
2019-05-22,레 벨이 정말 잘 올라요. 쉴 틈이 없다,별표 5개 만점에 5개를 받았습니다.,5
2019-05-22,ㅋ ㅑ ㅋ ㅑ하루종일 하게요 ㅋㅋㅋㅋㅋㅋ,별표 5개 만점에 5개를 받았습니다.,5
2019-05-31,팅김 전혀 없음 ! 근데 좀 끊김.. ㅋ 그래도 할만 함!!,별표 5개 만점에 5개를 받았습니다.,5
2019-05-21,감동감 갑 아직까지는 특별히 이상 없이 아주 잘 재미지게 하고있음,별표 5개 만점에 5개를 받았습니다.,5
2019-05-21,재미있네요. 뭐 나쁘지 않음~~,별표 5개 만점에 5개를 받았습니다.,5
2019-05-21,재미납니다~ 생각보다 쉽게 익숙해 지는데...,별표 5개 만점에 5개를 받았습니다.,5
2019-05-22,으….이런 악마의 유혹.. 멈출 수가 없어 ㅠㅠ,별표 5개 만점에 5개를 받았습니다.,5
2019-05-21,올 그래픽이 … 별5점 말 다했다 ㅋㅋㅋㅋㅋ,별표 5개 만점에 5개를 받았습니다.,5
2019-05-28,난 딱히 오류는 모르겠구 ㅋㅋ 걍 이정도면 퀄리티 괜찮다고 생각됨,별표 5개 만점에 5개를 받았습니다.,5
2019-05-28,많은 업데이트와 발전을 기대하며 5점 남기고 갑니다,별표 5개 만점에 5개를 받았습니다.,5
2019-05-31,시간 때우기 좋음 근데 한판으로는 끝내기 아쉬워서 계속하게됨 ㅋ,별표 5개 만점에 5개를 받았습니다.,5
2019-05-22,영상이나 게임 그래픽 퀄은 아직 모르겠음 근데 할만은 한거 같음,별표 5개 만점에 5개를 받았습니다.,5
2019-05-21,내게 꼭 필요한 게임인 듯 합니다!!,별표 5개 만점에 5개를 받았습니다.,5
2019-05-28,플레이 할수록 캐릭이 쌔지는게 눈에 보여서 좋아요~~,별표 5개 만점에 5개를 받았습니다.,5
2019-05-27,종료 왜죠 왜끝내기가 않되는건데요 일해야 하는데 종료가않됨 그이유로 게임 접음,별표 5개 만점에 1개를 받았습니다.,1
2019-05-22,알피지는 판타지만 있는 줄 알았는데 참신합니다.,별표 5개 만점에 5개를 받았습니다.,5
2019-05-29,굿 아직 많이 해보지 않았지만 앞으로도 재밋길 바라며 5점!,별표 5개 만점에 5개를 받았습니다.,5
2019-05-21,MMORPG 만의 매력이 확실히 잘 살아 있는 것 같음!!,별표 5개 만점에 5개를 받았습니다.,5
2019-05-22,게임 속도감이 어마무시 ㅋ 노가 다가 지루하지 않은건 처음이네요,별표 5개 만점에 5개를 받았습니다.,5
2019-05-22,드디어 할만한 게임 찾아네 ㅋㅋㅋㅋㅋㅋ감사여,별표 5개 만점에 5개를 받았습니다.,5
2019-05-21,와 그냥 중국 양산형 그레픽좋은 게임이네ㅋ 5분 하고 지움,별표 5개 만점에 1개를 받았습니다.,1
2019-05-22,잼따!! 친구들이랑 같이 하고 있어요!!,별표 5개 만점에 5개를 받았습니다.,5
2019-05-30,기존MMORPG랑 다른 색다른 플레이 방식이라 좋습니다.,별표 5개 만점에 5개를 받았습니다.,5
2019-05-21,기대했던건 만큼은 하는 재미가 있네요 오래할지는 아직 미지수,별표 5개 만점에 5개를 받았습니다.,5
2019-05-22,바쁘다보니 오늘이 되서야 제대로 하네요 즐겜합니다.,별표 5개 만점에 5개를 받았습니다.,5
2019-05-22,아르카 인기가 넘실넘실대네요 ㅎㅎㅎ~~~,별표 5개 만점에 5개를 받았습니다.,5
2019-05-29,개인적인 취향에는 잘 맞네요. 재밌어요^^,별표 5개 만점에 5개를 받았습니다.,5
2019-05-22,역시… 휴일엔 아르카엿어 내 지갑은 열려버렷어 ㅋㅋㅋㅋ,별표 5개 만점에 5개를 받았습니다.,5
2019-05-22,MMORPG는 필드사냥이지 MMORPG는 아르카지 ㅋㅋㅋㅋㅋㅋ,별표 5개 만점에 5개를 받았습니다.,5
2019-05-22,광고보고 해봤는데 ㅋㅋㅋㅋ재밌네요 ㅋㅋㅋ,별표 5개 만점에 5개를 받았습니다.,5
2019-05-22,탈것도 멋지고 열심히 하는 중입니다.,별표 5개 만점에 5개를 받았습니다.,5
2019-05-21,자잘한 렉이 살짝잇긴한데 게임이 재밌어서 욕은 안하겠음ㅋㅋㅋ,별표 5개 만점에 5개를 받았습니다.,5
2019-05-21,ㅋ.ㅋ일하는데 이것만하는중 ㅋㅋㅋㅋㅋㅋ,별표 5개 만점에 5개를 받았습니다.,5
2019-05-22,별 1도 주기 아까워요..왜 설치가 안되는거죠?,별표 5개 만점에 1개를 받았습니다.,1
2019-05-22,와.. 진짜 시간가는줄모르고함 관전도 재밌기는 첨인데,별표 5개 만점에 5개를 받았습니다.,5
2019-05-21,내가 할만 한 게임을 찾았다는거… 대단한게임임,별표 5개 만점에 5개를 받았습니다.,5
2019-05-21,원래 알피지 진짜 못하는데 ㅋㅋㅋ 그래도 이건 할만해요 ㅋㅋㅋ,별표 5개 만점에 5개를 받았습니다.,5
2019-05-21,뭐야?? 재밌기만 하네.... 뭐가 문제야 ㅎㅎ,별표 5개 만점에 5개를 받았습니다.,5
2019-05-21,게임 솔직히 안해봄.. 김혜자님이랑 시미켄형때문에 5점 드림,별표 5개 만점에 5개를 받았습니다.,5
2019-05-22,간만에 분위기 좋은 게임 발견! 저도 별5점 주고감,별표 5개 만점에 5개를 받았습니다.,5
2019-05-21,많은 시간 플레이는 못해봤지만 최소 얼마간은 이것만 할만큼 일단 재미있는건 인정합니다!!!^^,별표 5개 만점에 5개를 받았습니다.,5
2019-05-25,vip시스템 감사합니다. 2분만에 삭제했네요,별표 5개 만점에 5개를 받았습니다.,5
2019-05-28,ㅋㅋㅋㅋㅋㅋㅋ 당신들은 무슨 재미로 게임하는지 모르지만 난 불씨 강화시키는 재미로 한다,별표 5개 만점에 5개를 받았습니다.,5
2019-05-31,괜찮기는 한데 게임 보상이 좀 더 많으면 더더 좋겠네요.,별표 5개 만점에 5개를 받았습니다.,5
2019-05-31,그래픽 진짜 촌스러움의 극치. 바로 지움.ㅅㄱ,별표 5개 만점에 1개를 받았습니다.,1
2019-05-21,이게 게임이지!!! 아르카 대박입니다~~^^,별표 5개 만점에 5개를 받았습니다.,5
2019-05-21,시간 날 때 마다 틈틈히 즐기고 있어요.,별표 5개 만점에 5개를 받았습니다.,5
2019-05-22,"모바일 겜 몇 개 해봤는데, 그 중에는 이게 제일 나아요",별표 5개 만점에 5개를 받았습니다.,5
2019-05-22,해야하는 각이더라. 사실 받는게 얼마 안걸려서 깔아본거지만ㅋ,별표 5개 만점에 5개를 받았습니다.,5
2019-05-22,아놔~ 자꾸 욕심생기네ㅋㅋㅋ강해지고싶다!!!,별표 5개 만점에 5개를 받았습니다.,5
2019-05-22,"최적화가 진짜 잘되있네, 끊김이 하나도 없네요 굳ㅋㅋㅋ",별표 5개 만점에 5개를 받았습니다.,5
2019-05-21,그래픽이 생각보다 좋아서 놀랬어요 ㅎㅎ,별표 5개 만점에 5개를 받았습니다.,5
2019-05-29,자꾸 하게 만듭니다. 책임지세요 내 시간....,별표 5개 만점에 5개를 받았습니다.,5
2019-05-21,아주 재미있네요!!! 업뎃 잘해주세요!,별표 5개 만점에 5개를 받았습니다.,5
2019-05-21,오랜만에 집중하는 겜 아르카 같이 하자구요 (^-^)v,별표 5개 만점에 5개를 받았습니다.,5
2019-05-28,여러분 할만한 게임 찾는다면 일단 설치 하세요~~,별표 5개 만점에 5개를 받았습니다.,5
2019-06-04,다운도길고너무하네요,별표 5개 만점에 1개를 받았습니다.,1
2019-05-28,진짜 짱임!!! 오~~ 요새 할게임별로 없었는데... 이게임 알고부터 진짜 이거만함 ㅎ,별표 5개 만점에 5개를 받았습니다.,5
2019-06-01,무과금도 즐길 수 있는 갓겜 더 이상 말이 필요없다,별표 5개 만점에 5개를 받았습니다.,5
2019-05-21,영상이 대박임ㅋㅋㅋ 보다보면 게임인 거 까먹음 ㅋㅋ,별표 5개 만점에 5개를 받았습니다.,5
2019-05-21,아르카 겜 하기 시작하면.... 한시간은 후딱가네요ㅋㅋㅋ,별표 5개 만점에 5개를 받았습니다.,5
2019-05-21,위자드 보고 반해서 시작했지만 ㅋㅋㅋ 지금은 재밌어서 하게됨,별표 5개 만점에 5개를 받았습니다.,5
2019-05-21,은근히 재미 넘처옴 ㅋㅋㅋㅋㅋ 추천합니다!!,별표 5개 만점에 5개를 받았습니다.,5
2019-05-29,위자드 하는중인데 엄청 화려함ㅋ 다른직업 더 생겼으면 좋겠음,별표 5개 만점에 5개를 받았습니다.,5
2019-05-21,광고보고 기대해서 들어왔는데 기대만큼 요런것도 잼있네 ㅎㅎ,별표 5개 만점에 5개를 받았습니다.,5
2019-05-21,정말 좋네요 ㅋㅋㅋ 추천합니다!!,별표 5개 만점에 5개를 받았습니다.,5
2019-05-22,광고보고 왔는데 생각과는 좀 다르지만 그래도 할만한듯요,별표 5개 만점에 5개를 받았습니다.,5
2019-05-23,흑우들 노려서 한시즌 털어먹겠다는 심보가 그냥 보임 은근하지도 않아 ㅋㅋ,별표 5개 만점에 1개를 받았습니다.,1
2019-05-30,사실 아쉬운건 상상했던 스토리라는게 좀 아쉽지만 컨텐츠는 굳,별표 5개 만점에 5개를 받았습니다.,5
2019-05-31,그냥 켜놓고 지켜보고 누르면 되는 재미 ㅋㅋ 보는 재미 ㅋㅋㅋ,별표 5개 만점에 5개를 받았습니다.,5
2019-05-31,대체적으로 만족만족 ㅎㅎ 폰 게임이어도 이정도는 되야지,별표 5개 만점에 5개를 받았습니다.,5
2019-05-21,요즘 게임들 별론데 돈만 빨생각하고.. 이건 괜찮네요 ㅎ,별표 5개 만점에 5개를 받았습니다.,5
2019-05-21,스피디한 액션이랑 깔끔한 그래픽 맘에 듭니당~,별표 5개 만점에 5개를 받았습니다.,5
2019-05-21,이런 그래픽이 핸폰에 은근 잘어울리는 듯 ㅋ 퀄리티 은근 좋음,별표 5개 만점에 5개를 받았습니다.,5
2019-05-21,괜찮은 재미 ㅋㅋ괜찮은 스토리 ㅋㅋㅋ 괜찮은 모델 ㅋㅋㅋㅋ,별표 5개 만점에 5개를 받았습니다.,5
2019-05-21,신선도 한…70% 재미는 90% ㅋㅋ저의 기준입니다만 재미보장인듯,별표 5개 만점에 5개를 받았습니다.,5
2019-05-22,요즘 PC게임만 하고 있었는데 이것도 좋네요 ㅎㅎ,별표 5개 만점에 5개를 받았습니다.,5
2019-05-28,알피지안한지도 어언 몇년짼지.. 다시 하게된건 순전히 아르카 때문임..,별표 5개 만점에 5개를 받았습니다.,5
2019-05-24,서버안들어가지고인터넷확인하라그러고ㅡㅡ 돈썻는데이게뭔짓?,별표 5개 만점에 1개를 받았습니다.,1
2019-05-21,나쁘지는 않다 그렇다고 좋지도 않다 그냥 할만하다 ㅋㅋ,별표 5개 만점에 5개를 받았습니다.,5
2019-05-21,한 두세시간 했으려나 아직까지는 나쁘지 않네요.,별표 5개 만점에 5개를 받았습니다.,5
2019-05-21,다른 게임들과 다르게 스 토리가 재미있네요,별표 5개 만점에 5개를 받았습니다.,5
2019-05-21,요즘 이게임 주변에 모르는사람이 없음ㅎㅎ 인싸될려면 해야됨,별표 5개 만점에 5개를 받았습니다.,5
2019-05-28,많은 사람들이 즐기는 게임이 되었으면 합니다!,별표 5개 만점에 5개를 받았습니다.,5
2019-05-21,오--------ㅎㅎㅎㅎ 무과금으로도 할만한데 양심있네 ㅎㅎㅎ,별표 5개 만점에 5개를 받았습니다.,5
2019-05-22,오랜만에 마음에 드는 MMORPG가 나왔네요~~,별표 5개 만점에 5개를 받았습니다.,5
2019-05-22,재밌어요 재밌어!! 앞으로 꾸준히 관리 잘 해주세요,별표 5개 만점에 5개를 받았습니다.,5
2019-05-21,1시간 플레이했는데 욕 안나옴ㅋㅋ 그정도로 괜춘 친구에게도 추천했다,별표 5개 만점에 5개를 받았습니다.,5
2019-05-21,영자님ㅠㅠ 중지됫다고 뜨는데 어찌 해야하나요ㅠㅠ,별표 5개 만점에 2개를 받았습니다.,2
2019-05-21,아르카...진짜 갓겜이넹...ㅋㅋ 굿이야~~,별표 5개 만점에 5개를 받았습니다.,5
2019-05-21,뭐야 이 쾌속재미는..ㅋㅋㅋㅋㅋㅋㅋㅋㅋㅋㅋㅋㅋ,별표 5개 만점에 5개를 받았습니다.,5
2019-05-22,기대 이상이에요 아주 재미있게 플레이 중 이에요,별표 5개 만점에 5개를 받았습니다.,5
2019-05-21,스피드하면서 간결한 게임 좋아하는데 요거 딱 좋아요~,별표 5개 만점에 5개를 받았습니다.,5
2019-05-21,너무 재밌어서 리뷰 남김 아르카 오래오래 운영했음 좋겠어….ㅠㅠ,별표 5개 만점에 5개를 받았습니다.,5
2019-05-22,나만 이거 설치 안됨??? 할라고 했는데 못하겠네... 짜증,별표 5개 만점에 1개를 받았습니다.,1
2019-05-22,지금까지 너무 다 좋음 아르카는 사랑입니다.♡♡,별표 5개 만점에 5개를 받았습니다.,5
2019-05-29,나름 꾸준하게 하는 게임이네요 시작한지는 몇일안됬습니다만,별표 5개 만점에 5개를 받았습니다.,5
2019-05-31,"근래에 가장 재밌는 게임, 추천!!!^^",별표 5개 만점에 5개를 받았습니다.,5
2019-05-21,재밌음. 우리형이 추천해서 왔는데 재밌게 하겠음,별표 5개 만점에 5개를 받았습니다.,5
2019-05-22,30렙 이후에 레벨업이 살짝 막히는감이있네요,별표 5개 만점에 5개를 받았습니다.,5
2019-05-22,정령이 옆에서 앵알앵알 쓸데없는 말만 좀 덜하면 좋겠다 ㅋㅋ,별표 5개 만점에 5개를 받았습니다.,5
2019-05-21,2020년에서 왔습니다. 아르카는 갓흥겜이 됩니다,별표 5개 만점에 5개를 받았습니다.,5
2019-05-22,계속 좋은 컨텐츠 추가 부탁드릴게요~ㅎㅎ,별표 5개 만점에 5개를 받았습니다.,5
2019-05-22,만점!!! 완벽한 만점!!! 아르카 대박쓰~~^^,별표 5개 만점에 5개를 받았습니다.,5
2019-05-22,패치로 더 재밌어 질걸 생각하니까 진짜 기대됩니다.,별표 5개 만점에 5개를 받았습니다.,5
2019-05-22,과금 없이도 충분히 즐길만함… 컨텐츠도 많다.,별표 5개 만점에 5개를 받았습니다.,5
2019-05-22,이게임 진짜 최고에영 운영자님 짱짱!!!!!,별표 5개 만점에 5개를 받았습니다.,5
2019-05-21,현질할려고 하는데 어떤거 사면 좋나요??? 추천점ㅋㅋ,별표 5개 만점에 5개를 받았습니다.,5
2019-06-01,올 그래픽은 내취향이고. 분위기도 좋슴돠!!!,별표 5개 만점에 5개를 받았습니다.,5
2019-05-21,MMORPG 유저들이 엄청 현질하겠네ㅋㅋㅋ 특성상 미리 질러놔야 나중에 편함,별표 5개 만점에 5개를 받았습니다.,5
2019-05-21,@@ @@ 중독성 대박입니다 시간 가는지도 모르고 빠지게 되요,별표 5개 만점에 5개를 받았습니다.,5
2019-05-28,부담 없이 즐기기엔 정말 좋네요...,별표 5개 만점에 5개를 받았습니다.,5
2019-06-01,이것저것 자동화 되있으니까 진행하기 편하네요.,별표 5개 만점에 5개를 받았습니다.,5
2019-05-21,로그인 왜안되죠 빨리고쳐주세요 운영자님,별표 5개 만점에 5개를 받았습니다.,5
2019-05-22,메인퀘스트 말고 컨텐 츠가 많아서 그런지 지루하지않네요,별표 5개 만점에 5개를 받았습니다.,5
2019-05-21,초반 부터 분위기 좋네여 요즘 보기 드문데 ㅋㅋ,별표 5개 만점에 5개를 받았습니다.,5
2019-05-22,유후^^ 집중할만 한 게임 발견한 것 같습니다.,별표 5개 만점에 5개를 받았습니다.,5
2019-05-23,다운...설치...실행...감동 잘만들었내요,별표 5개 만점에 5개를 받았습니다.,5
2019-05-22,MMORPG의 디테일이 다릅니다^^ 해본 사람들을 압니다!!!,별표 5개 만점에 5개를 받았습니다.,5
2019-05-21,생각날때마다 접속해서 해도 흐름 안끊기고 할수있어요 ㅋㅋ,별표 5개 만점에 5개를 받았습니다.,5
2019-05-22,여태해본 게임 중에 렙업 젤빠름!!! 그니까 할맛난다ㅋㅋ,별표 5개 만점에 5개를 받았습니다.,5
2019-05-25,다운로드 시도 5회차인데 다운이 안되네요,별표 5개 만점에 1개를 받았습니다.,1
2019-05-22,진심 처음해보고 '트라하'보다 임팩트가 강했다!!!,별표 5개 만점에 5개를 받았습니다.,5
2019-05-29,그냥 그림만 봐도 딱 내 스타일이네 ㅋ,별표 5개 만점에 5개를 받았습니다.,5
2019-05-29,진짜진짜 꿀잼입니다. 꼭!!! 해보세영~,별표 5개 만점에 5개를 받았습니다.,5
2019-06-01,잼있네요 하다보니 시간이 훅 가버릴 정도로 ㅎ,별표 5개 만점에 5개를 받았습니다.,5
2019-05-21,저는 왜 게임 접속이 되지 않죠?ㅠ,별표 5개 만점에 1개를 받았습니다.,1
2019-05-21,쉴틈없이 할게 많은데 디테일한 설정도 많아가지고 좋타 편하게 할만함,별표 5개 만점에 5개를 받았습니다.,5
2019-05-22,재밌네요 시작한지 얼마 안됬지만 추천합니당,별표 5개 만점에 5개를 받았습니다.,5
2019-05-30,그래픽이 뛰어나서 ㅋㅋㅋㅋ 역시나 하게되었습니다,별표 5개 만점에 5개를 받았습니다.,5
2019-06-01,"크게 현질 안해도 할만한거 같음, 아직까지는……",별표 5개 만점에 5개를 받았습니다.,5
2019-05-21,특이하네요. 해본적없는 타입~!!!,별표 5개 만점에 5개를 받았습니다.,5
2019-05-21,중간중간에 서버 렉이 진짜 가끔있는거 빼곤 만족합니다,별표 5개 만점에 5개를 받았습니다.,5
2019-05-22,아르카.. 생각한 정도는 아니지만 할만합니다.,별표 5개 만점에 5개를 받았습니다.,5
2019-05-22,오~ 개성있네요 특이 합니다. 걍 재밌는 MMORPG네요,별표 5개 만점에 5개를 받았습니다.,5
2019-05-31,렙업 아직까지는 빠른거 같은데...닥사 구간 있나요??,별표 5개 만점에 5개를 받았습니다.,5
2019-05-31,못 헤어나온다 장르의 순수한 재미를 괜찮게 살렸다.,별표 5개 만점에 5개를 받았습니다.,5
2019-05-22,광고 많이 하길래 해봤는데 생각보다 나쁘지않네여~,별표 5개 만점에 5개를 받았습니다.,5
2019-05-21,🌠🌠딱 좋네 그래픽도 그렇고 시스템도 그렇고... 잼나넹,별표 5개 만점에 5개를 받았습니다.,5
2019-05-22,사람많았으면 좋겠다!!! 다같이 즐기자,별표 5개 만점에 5개를 받았습니다.,5
2019-05-24,그래픽도 이쁘고 너무 재밌습니다!,별표 5개 만점에 5개를 받았습니다.,5
2019-05-30,여자친구랑 잘~~ 하고 있어요 ^^,별표 5개 만점에 5개를 받았습니다.,5
2019-05-31,시간 많이 안써도 되게 잘 만들어놨네요!!!,별표 5개 만점에 5개를 받았습니다.,5
2019-05-22,혜자스런 게임이군 진짜 ㅋㅋㅋㅋ 아주 마음에 듭니다요,별표 5개 만점에 5개를 받았습니다.,5
2019-05-27,다운로드 시간이 너무 길어요;;,별표 5개 만점에 3개를 받았습니다.,3
2019-05-22,여러가지 받으면서 하니까 할 맛이 나네요 ㅋㅋㅋ,별표 5개 만점에 5개를 받았습니다.,5
2019-05-28,맘에 들어서요..재밌게할게요~~,별표 5개 만점에 5개를 받았습니다.,5
2019-05-28,하면 할 수록 점점 더 재밌어지네요ㅋ,별표 5개 만점에 5개를 받았습니다.,5
2019-05-29,그래픽이나 사운드 컨트롤 이런것도 좋구요. 자동 이동이 꽤 편하네요.,별표 5개 만점에 5개를 받았습니다.,5
2019-05-30,강추합니다 왠만한 MMORPG 중에 가장 괜찮아요 깔끔하고~~,별표 5개 만점에 5개를 받았습니다.,5
2019-05-31,재밌당 첫 소감은 나름 만족스럽습니다.ㅎㅎ,별표 5개 만점에 5개를 받았습니다.,5
2019-05-21,아르카의 성공을 진심으로 기원합니다 ^o^,별표 5개 만점에 5개를 받았습니다.,5
2019-05-21,반자동이라서 편하면서 불편하지만.... 아직 할만함ㅎ,별표 5개 만점에 5개를 받았습니다.,5
2019-05-21,즐길거리가 좀 더 많아졌으면 합니다!!!,별표 5개 만점에 5개를 받았습니다.,5
2019-05-28,갬 재미있다 추천 버튼이 있다면 꾹 누를 수 있으면 좋겠다,별표 5개 만점에 5개를 받았습니다.,5
2019-06-01,완성도도 있고 간만에 오래할 만한 게임 나왔네요.,별표 5개 만점에 5개를 받았습니다.,5
2019-06-01,재밌네요 시간 떼우기 나쁘지 않습니다.,별표 5개 만점에 5개를 받았습니다.,5
2019-05-21,핸드폰 게임 치곤 아주 괜찮네요 앞으로도 기대 합니대이 ㅡㅡ,별표 5개 만점에 5개를 받았습니다.,5
2019-05-28,스토리가 일단 자연스러움 CG 영상이랑도 엄청 잘 어울림,별표 5개 만점에 5개를 받았습니다.,5
2019-05-25,중국양산형 vip시스템.. 지겹다.. 이런거좀 그만찍어내자,별표 5개 만점에 1개를 받았습니다.,1
2019-05-29,듀토리얼까진 그냥 그랬는데 해보니깐 진짜 재밌네요 ㅎㅎ,별표 5개 만점에 5개를 받았습니다.,5
2019-05-30,좀만 더 다듬어지면 훨씬 괜찮을것 같은 게임 ㅋㅋ,별표 5개 만점에 5개를 받았습니다.,5
2019-06-01,재밌네.. 시간가는줄 모르겠어요 ㅋㅋ,별표 5개 만점에 5개를 받았습니다.,5
2019-05-31,이거 언제 나온건가요 ㅋㅋ 진짜 재미있는데요 ㅎㅎ,별표 5개 만점에 5개를 받았습니다.,5
2019-06-01,근래에 찾은 가장 괜찮은 게임인 거 같네요 ㅎㅎ,별표 5개 만점에 5개를 받았습니다.,5
2019-05-21,과금이 조금 필요한거 같긴한데 할만하네요~,별표 5개 만점에 5개를 받았습니다.,5
2019-05-22,중국산양산복붙.. 영상광고제작비용이아깝네요.,별표 5개 만점에 3개를 받았습니다.,3
2019-05-28,ㅋ ㅋ 시간이 없어서 많이는 못하지만 나무 꿀잼 ^o^,별표 5개 만점에 5개를 받았습니다.,5
2019-05-29,아르카가 내가 해본 MMORPG 중에 몰입도가 최고인 듯!!!,별표 5개 만점에 5개를 받았습니다.,5
2019-05-23,설치두번이나햇는데 왜안됨?? ㅡㅡ계속 설치만뜨는건머임,별표 5개 만점에 1개를 받았습니다.,1
2019-05-30,역대급까진 아니더라도 잘만든 게임인 듯!!,별표 5개 만점에 5개를 받았습니다.,5
2019-05-29,꿀잼이네요 ㅋㅋㅋ 재미있게 하고 있어요~~,별표 5개 만점에 5개를 받았습니다.,5
2019-05-29,일단하게 되면 계속해서 하게되는 듯!!!!,별표 5개 만점에 5개를 받았습니다.,5
2019-06-01,이맛에 아르카합니다 ㅋㅋㅋ MMORPG맛 잘살렷네요 ㅋㅋㅋㅋ,별표 5개 만점에 5개를 받았습니다.,5
2019-05-22,아마 근래에 찾은 가장 괜찮은 게임인거 같네요 진심 레알✅,별표 5개 만점에 5개를 받았습니다.,5
2019-05-21,아.르.카. 보는 맛이 있어서 좋음❕❕,별표 5개 만점에 5개를 받았습니다.,5
2019-05-22,훌륭하다. 별 5개 받을만하다..,별표 5개 만점에 5개를 받았습니다.,5
2019-05-29,굳!! 재미 보장함 지인추천으로... 겜 시작!,별표 5개 만점에 5개를 받았습니다.,5
2019-06-01,할만한디 ㅋㅋㅋ 제가 할만하다하면 진짜 할만함 ㅋㅋㅋ,별표 5개 만점에 5개를 받았습니다.,5
2019-06-03,사용자 경험에 관해 셜명(선택사항),별표 5개 만점에 4개를 받았습니다.,4
2019-05-29,너무너무 재밌습니다. 짱짱 ㅋㅋ,별표 5개 만점에 5개를 받았습니다.,5
2019-05-29,정말 맘에 듬! 전투 조작도 쉽고 오토도 꿀임,별표 5개 만점에 5개를 받았습니다.,5
2019-05-31,명불허전 이게임은 대박일거라 생각했습니다 ㅋ,별표 5개 만점에 5개를 받았습니다.,5
2019-05-31,참신한 게임!!! 할만한 게임인 거 같다!!,별표 5개 만점에 5개를 받았습니다.,5
2019-05-21,썰고 베는 맛이 있네요 그저 그런 게임 이상은 것 같아요,별표 5개 만점에 5개를 받았습니다.,5
2019-05-21,왜들이래 재밌기만 하구만. 갓겜으로 보인다.,별표 5개 만점에 5개를 받았습니다.,5
2019-05-29,이벤 트로 꽤나 많이 퍼줘서 소소하게 즐겁게 할수있어요,별표 5개 만점에 5개를 받았습니다.,5
2019-05-31,뭐지 ...점점 중독이 된다....뭐지~~,별표 5개 만점에 5개를 받았습니다.,5
2019-05-31,꿀잼 강추 ㅎㅎㅎ 해보면 알게되는 그래픽과 사운드 ㅋㅋ,별표 5개 만점에 5개를 받았습니다.,5
2019-06-01,게임에서 모르는거 유저들이 친절하게 알려줌ㅋㅋ,별표 5개 만점에 5개를 받았습니다.,5
2019-05-22,컨텐츠도 다양하고 좋네요~ㅎㅎ,별표 5개 만점에 5개를 받았습니다.,5
2019-05-29,5분만에 접음. 할말없슴.,별표 5개 만점에 1개를 받았습니다.,1
2019-06-01,레벨업이 빨라서 매우 좋음 ㅎㅎㅎ 좀 더 해봄,별표 5개 만점에 5개를 받았습니다.,5
2019-05-21,그래픽 좋은데 아직 조금 끊겨요ㅜㅜ 파이팅입니다!,별표 5개 만점에 5개를 받았습니다.,5
2019-05-21,나온지 몰랐네요 -_-;;; 완벼크합니다,별표 5개 만점에 5개를 받았습니다.,5
