time,review_txt,stars_txt,ratings
2019-05-13,S10 사용자는 겜 접어야 함. 설치를 겨우 했더니 이젠 패치 다운로드가 안됨./ 매클 답변말고 S10에서 설치중인데 패치 99.8%에서 진전이 없습니다. 한시간째. 삭제후 재설치도 몇번해보고 재부팅도 해봤지만 같은상황. 해결을 좀 해야되지 않겠어요? 같은 증상이 많아 보이던데.,별표 5개 만점에 1개를 받았습니다.,1
2019-04-07,갤10+ 사용자 입니다. 모든 강화 및 레벨업시 화면이 계속 번쩍이면서 먹통되고 팅깁니다. 플레이시에도 화면이 정상적이지않고 간헐적으로 번쩍 번쩍합니다. 첨에는 안그랬는데 문제가 있는것 같습니다. 원활한 겜을 위해 빠른 조치부탁드립니다.,별표 5개 만점에 1개를 받았습니다.,1
2019-05-09,제발 신규 무기 방어구 종류를 더이상 추가하지 말아주세요. 간결하면서 깔끔하게 예를들면 희귀템에 모든 속성을 각각 속성강화를 통해 한가지 아이템에 관리될 수 있도록 검토해 주십시오. 그리고 날개는 언제쯤 업데이트 되나요? 이쯤이면 날개 선보일때가 된것 같은데요. 그리고 동맹원정 정상층 난이도 낮춰서 많은 유저분들이 혜택을 많이 볼수있는 게임이 되었으면 좋겠습니다.감사합니다.,별표 5개 만점에 5개를 받았습니다.,5
2019-03-29,"LG폰은 버려지나요? G7인데 캐릭터 다른걸로 선택도못하고 게임으로 들어가니 인터페이스는 싹사라지고... 스킬버튼이며 지도며 퀘스트창이며 싹다 없는데... 뭐가 다르다고 이렇게되지...;;; 재설치를 해도 똑같고.... ""불칸 리소스 사용"" 활성화 상태인데도 똑같습니다. 재설치 할때도 활성화하고 패치 추가로 받고나서 들어가는데 그냥 없어요 똑같습니다.",별표 5개 만점에 4개를 받았습니다.,4
2019-04-25,처음부터 지금까지 겜을 하고 있는데.. 와.. 오늘은 정말 욕이.. 턱 끝까지오네요.. 뭐하자는건지.. 공식 커뮤니티? 유저들 데리고 장난하나? 열리지도 않은데 뭔 확인? 실속 챙기는게 있으면 책임감도 좀 갖으세요..,별표 5개 만점에 1개를 받았습니다.,1
2019-03-14,관계자.여러분.수고하고.있읍니다.다만.몇몇.혈맹이.물을.흐리고.있는상황?알고계시죠?글구.제제는.안하시는지.긍금합니다.저는.이게임.사랑합니다.감사한.마음.항상.가지고.있고.~흠~수고하세요.항상~^^,별표 5개 만점에 5개를 받았습니다.,5
2019-04-06,이틀전에겔s10으로휴대폰바꿨는데 자꾸멈추고튕겨서 휴대폰a/s센터갔더니 게임이 휴대폰os를못따라오는거라멈추고튕기는거라는데맞나요?화면색이 울긋불긋 바뀌다가멈춰버리고 이런현상이너무잦아요 게임다시지우고깔아도 소용없네요..이해가안됨ㅠ게임이핸폰사양을못따라온다는게..,별표 5개 만점에 3개를 받았습니다.,3
2019-05-19,갤럭시s10 5G에서 불안정한현상이 계속나오는데 수정작업안하시나여? 업데이트복구후에서 동일증상계속나오는데 계속재접하기도 짜증납니다...던전한곳 완료하고 다음던전가려고 나가기를 누르면 로딩화면이 멈추거나 달달떨다가 멈추는건 해결안하나여?,별표 5개 만점에 4개를 받았습니다.,4
2019-03-14,과금아니면 힘든겜. 업뎃할때마다 현질유도 업뎃만 하는거같음 . 이제 코스튬도 현질만 나옴. 매출 줄어드는거 같으면 펫만주구장창 내놓음.(물론 현질)내돈내고하는 자동퀘는 매번 몹에걸려잇어서 퀘진행을못하고있음..개선 절대안해줌 .캐릭간밸런스 똥망. 핵과금러아니면 힘든겜~,별표 5개 만점에 1개를 받았습니다.,1
2019-05-31,겔S10+ 사용자들은 게임 하지말라는겁니까?오늘 업데이트 이후 패치 파일 받으려는데 안받아져서 게임 삭제하고 다시 받고 하는데도 패치 다운도 진행이 안되고 있는데..도대체 왜그런건가요?밑에서도 언급했지만 화면 떨림도 개선이 안되는 이유는 뭔가요?,별표 5개 만점에 1개를 받았습니다.,1
2019-05-25,겔럭시 5G 인데 설치하고 패치다운 받는데 99.9%에서 멈춰 더이상 진행되지 안습니다. 문제해결좀 해주세요 언제까지 기다려야하는지 보상은 해주는건지 얼렁뚱땅 조속히 처리하네 노력하네 알아보는중이네 불편을끼쳐 죄송하네 이딴말 필요없고 정확한답변 보내주세요.,별표 5개 만점에 1개를 받았습니다.,1
2019-05-13,밑에 글 올리신분 처럼 저도 갤10 5G 사용자인데 어제부터 갑자기 업뎃 있다고 다운로드 하라고 해서 확인 눌렀는데 한시간 동안 다운 1도 안되고 폰 껏다 켜고 해도 안되고 LTE 로 접속해도 안되고 겜 삭제하고 다시 까는데 99.8%에서 더이상 다운 안되고 와이파이도 마찬가지고 이건 뭐 겜을 하라는건지 말라는건지.. 그전에도 겜 할때 정던 들어가려고 하면 겜 멈추고 정말 짜증나네요 이럴거면 겜 접을테니까 이번달 아이템 결제한거 취소해주세요,별표 5개 만점에 1개를 받았습니다.,1
2019-03-21,뭔 게임이 업데이트도안됩니까? 제휴대폰이노트9인데 업데이트 하려다가 안되서 삭제하고 다시깔아보니 케릭터는 다 날라가고 다시 시작하는 마음으로 하고있는데 또그러네 이런게임은 시작을하지마시지. 사람가지고 노는것도아니구 욕 할수있음 다퍼붓고싶네,별표 5개 만점에 5개를 받았습니다.,5
2019-04-07,갤럭시s10 5G로 바꾼후로 계속 번쩍번쩍 거리고 레벨업 강화 뭘하려해도 팅겨요..점점 승질이 나려해요ㅡㅡS7도 가지고잇는데 그건 정상인것으로 보아 S10만 그런건가요? 빠른조치 부탁해요!!!,별표 5개 만점에 1개를 받았습니다.,1
2019-05-31,제가 전에 플레이했을때 너무 재밌었던 기억이 있어서 다시 다운받았는데 캐릭터 선택 화면에서 자꾸 튕깁니다. 그리고 플레이중 화면이 세로로 바뀌는 경우가 있습니다.이 오류들만 고쳐주시면 별 5개 드립니다.,별표 5개 만점에 3개를 받았습니다.,3
2019-04-25,이건 뭐 업뎃을 하루종일 할려나..마켓 핑계나 되고 지금 뭐하자는 겁니까!내일 출근 때문에 게임 못하는 사람들 보상은 어찌할라고 이러는건지..마프로 하나? 마프로 랜덤상자 하나? 이런걸로 퉁 칠라는건 아니겠죠??그럼 진짜 유저들 쌍욕 하고 이대로 안넘어 갑니다. 참고로 탐욕 상자도 줘야 됨!,별표 5개 만점에 5개를 받았습니다.,5
2019-04-25,누구를 위한 게임입니까? 업데이트 벌써 21시간이 지났습니다. 유저들에게 사과하나없이 이 무슨 경우입니까?,별표 5개 만점에 1개를 받았습니다.,1
2019-05-02,"업데이트 이후 게임중 렉,순간이동 시 멈추면서 튕귐심합니다 겔럭시노트9 512기가 쓰는대 게임이 아무리 고사양게임 이라도 휴대폰사양이 못따라갈리가 있나요 게임좀 할려고 하면 렉생기면서 멈추고 찌증나죽겠습니다 빠른 해결좀 해주세요",별표 5개 만점에 1개를 받았습니다.,1
2019-04-26,여친이랑 리니지하면서 만났는데..ㅎㅎ 아직까지 하고있네요~~^^덕분에좋은인연 만들어줘서 감사해요~번창하세요~~^^,별표 5개 만점에 5개를 받았습니다.,5
2019-03-20,아니!! 정말 너무한거 아닌가요? 강화확률좀어에해봐요 어떻게 축강을 연타로 바르고 해도 9강이 연속으로 떨어지냐고 이게 말이되냐고요 겜접어야될지경이네요 와나 장난하는것도 아니고 축강 30개발랐는데 제자리 머하자는 거지? 정말 장난질 제대로하네 화가난다 겜접어야겠음,별표 5개 만점에 1개를 받았습니다.,1
2019-05-08,갤럭시s10 plus user 입니다. 불칸리소스 사용시 화면깨짐과 장비 레벨업시 화면이깨지면서 멈춤현상이 일어나는데요. 이부분 언제 해결되는건가요?,별표 5개 만점에 2개를 받았습니다.,2
2019-05-09,제가. 초보라. 서브캐릭들은. 사냥이. 다되는데. 2틀째. 본캐가. 사냥이. 되질 안아여 왜그런걸가여 몹들도. 천하무적이고 왜그런거져,별표 5개 만점에 1개를 받았습니다.,1
2019-05-15,"갤10 던전 한번하고 화면 멈추는 현상, 옵션변경하면 멈춤현상, 메인퀘스트 완성시 화면 겹침현상, 화면 깜박거림 현상 결정적으로27.6M 업데이트 안돼서 접음",별표 5개 만점에 1개를 받았습니다.,1
2019-05-04,교환한다는 글을 월창에다가 올렷다는이유로 15일씩이나 접속금지를 시켜요? 교환햇으면몰라 교환한거확인하는것도귀찮다는듯이 15일이나 접속금지시키고 참대단들하시네요 좀줄여주시던지 해주세요,별표 5개 만점에 1개를 받았습니다.,1
2019-05-29,처음키우면 sr30레벨 20강화 셋트로 주는데. 또 새로 하나더 키우면 sr1레벨 20강화로 줌니다.. 다시. sr30레벨. 20강화셋트로 받을려면 어케 해야 하는지요? 이미 한번 받으면 끝인가요?,별표 5개 만점에 2개를 받았습니다.,2
2019-05-26,솔찍히 별한개도 아깝다. 10일이지났는데 아직 겔럭시s10 왜 문제인지 찾지도못하는 돈마블 지금 겔럭시s10으로만 게임하는 호객님 하면서 넷마블은 또이렇게 죄송합니다 근데 호객이 되줘서 고맙다며 낄낄대겠지ㅋㅋㅋ전문가 맞나 궁금할정도로 진짜 문제많네ㅋㅋㅋ앞으로 겔럭시가지고 레볼전용휴대폰이니 개소리하지말고 그런 cf찍지마라ㅋㅋ애플 아이폰이나 아이패드로만찍어라ㅋㅋㅋ유저들 돈으로보는 고객센터 갑질하는 상담원들아ㅋㅋ,별표 5개 만점에 1개를 받았습니다.,1
2019-05-23,갤럭시s10은 접읍시다! 아니 무슨 겜중 팅긴다고 그럽니까? 게임패치가 아예 안되는구만. 끝물이라고 운영 이렇게 하시면 곤란합니다.,별표 5개 만점에 1개를 받았습니다.,1
2019-04-04,게임을 하려고 다운로드를 했는데 시작을 못하고 있다 처음에 동의를버튼을 누르고 터치 더 스크린이 나오길래 화면을 눌러도 반응이 없다 5분넘게 기다려봐도 껏다켜봐도 화면에는 터치더스크린만 나온다,별표 5개 만점에 1개를 받았습니다.,1
2019-05-01,2년동안 게임 잘해왔는데 통합. 하고나서 이런씩으로 관리. 합니까 ㆍ나원참 대기를. 해요 무슨 군부대도 아니고 대기타서. 게임을 하라니 기가차고 코가 막혀서 삭제 합니다ㆍ 자유한국당 가치 자기들 맘대루하는 운영 반대 합니다ㆍ 망해야 정신. 차리실려나 삭제 합니다ㆍ,별표 5개 만점에 1개를 받았습니다.,1
2019-05-17,지금 어제부터 패치가 다운로드 시작하면 몇시간째 0프로에서 멈춤 !! 안되고 있어요 !! 짜증이나서 미치겠습니다 뭐하는겁니까 !!! s10+ 입니다 !! 어서 조치하세요 !!!!,별표 5개 만점에 1개를 받았습니다.,1
2019-04-26,잘돌아가다가 비정상적인 접속이라며 오류가 나는데 고쳐질 생각은 없고 오늘하루닫기화면 눌러놔도 접할때마다 뜨구 돈벌생각은 좋아보이는데여 쓸수잇게는 해놔야지 원.. 패치했다하면 하루종일 하고 또하고 ㅋㅋ 언제고쳐줄거에영.. 하라는건지 말라는건지..,별표 5개 만점에 3개를 받았습니다.,3
2019-03-21,지금~~3일째g7폰만~~방향키하고~캐릭터만보이고~아무것도없음~~g7폰겜하던사람은버리는건가?빨리조치해주세요~~이런적이없었는데...,별표 5개 만점에 1개를 받았습니다.,1
2019-03-29,대단하십니다 몇번을 다시 시작했지만 말도 안되는 강화확률에 기껏해서 블루다이야 충전했더니 그린다이야 나와서 거래소 사용도 못하게 하고 제가 별 드린이유는 엉망으로 만든점수 드린겁니다. 과금도 작작유도 하시고 어느정도 성공률을 줘야 게임을 하지 이건 뭐 진짜 해도 너무 하시네요 완전 계정삭제 하기전에 글 남깁니다 잘 만드신 게임 너무 돈돈돈 생각해서 조작하지 마세요 다 국내 게임들 하는 사람들 거기서 거기 입니다 해도해도 너무 하신듯 하네요.,별표 5개 만점에 5개를 받았습니다.,5
2019-05-03,아니 왜 서버를 통합해서 접속도 지대로 못하게 만드냐구요. 혼잡하다고 대기해야되고...뭐하자는건데요.,별표 5개 만점에 1개를 받았습니다.,1
2019-05-30,뭔가를 추가해서 사용자들 돈쓰게만들라는 생각좀 덜해도 게임이 이따구로 변하지않았을듯 . 점점 게임품질이 떨어지고 이게뭐임 뭐만하면 팅기고 렉걸리고 화면안넘어가고 템날리기 일쑤임 제발 사용자들 돈뜯는거보다 겜품질부터 점검하세요,별표 5개 만점에 1개를 받았습니다.,1
2019-04-25,"일부 고투력유저의 휑포가 심해 게임을 즐길수가없어요.정던이나 채집지역에서 이유없이 계속죽이네요.저렙,저투력유저분들 게임 의욕상실.pk금지지역으로 설정해주셨음 합니다.",별표 5개 만점에 1개를 받았습니다.,1
2019-05-01,아니 업뎃을 했는데도 변한건 하나도 업스ㅡ 여전히 그대로 겜은 무한로딩하다가 멈추고 꺼지고 ㅡㅡ 이제 진쩌 슬슬 짜증이 나려고 하네요.. 게임을 갈아타야 하나 ㅡㅡ,별표 5개 만점에 1개를 받았습니다.,1
2019-04-09,왜 메인퀘만 진행하면 캐릭터들이 깜빡깜빡거리면서 팅기고 재접하면 무한 로딩으로 못 들어가나요? 몇달전부터 그래서 문의도 무시당해서 접다 왔더니 지금도 여전하네요.. 수많은사람들이 같은 문제로 얘기하는데 근본적인건 안 고치고 너무 하지 않나요? 문의하면 일시적으로 해결해준다쳐요 근데 다른캐릭 또 그러면 또 문의해야하고ㅋㅋ 나중에 메인퀘하면 또 그러고.. 언제까지 안고치실건가요? 또 문의도 넣어놓은 상태지만 답답해 죽을거같네요 이번에도 무시당하면 미련남을일도 없겠습니다,별표 5개 만점에 1개를 받았습니다.,1
2019-04-25,3단 패키지 11만원짜리 샀는데 패치하면서 신상품이 3단 한방패키지를 낸다고? 22만원 아니기만 해봐라. 기존에 산 사람들 우롱하냐? 내가 여기다 쓴돈이 얼만데 이건아니지,별표 5개 만점에 1개를 받았습니다.,1
2019-04-26,운영자님 다시 케릭만들어서 247렙 올렸는대 금방 패치되고 케릭 사라졌네요.케릭명 마음의창..마음의문.. 페북과 연동했습니다.첨 케릭들 찾아도 없더니 오늘은 옛날 케릭들만 보이고 힘들게 키운 케릭만 사라졌네요.똑 바로 안할낍니까?,별표 5개 만점에 3개를 받았습니다.,3
2019-05-19,이봐요 운영자님 리니지 케릭터를 맘대로 삭제하면 어떡합니까 있어야할 서버에 케릭터가 없잖아요 이거 계정 주인 허락도 없이 삭제해도 되는겁니까 빨리 지금 당장 복구 시켜놓으세요,별표 5개 만점에 1개를 받았습니다.,1
2019-04-26,섭통합 후 캐릭터 삭제 관련하여 기존에 5개씩 만들었는데 이번 섭 통합 후로 10개가 되면서 5개는 삭제 예정으로 되어 있습니다. 이들을 살리고 싶은데 어찌해야 하는지 다른 공지에 없어 여기 문의드리니 답변 부탁드립니다,별표 5개 만점에 4개를 받았습니다.,4
2019-05-06,복귀유저 입니다 노트9 으로 게임진행시 자동퀘스트 진행중이거나 에피소드 완료창 넘어갈때 다른맵으로 이동할때 던전완료후 기존맵으로 진입하는과정 중에 그래픽깨짐현상과 무한로딩으로 화면깜빡이다가 검은화면으로변경된후 게임에서 튕기는현상이 빈번히 발생되고있습니다.. 지금도 계속진행형이고 게임을못할정도까지인데요.. 확인후 조치바랍니다...,별표 5개 만점에 1개를 받았습니다.,1
2019-04-03,갤s10으로 갬을 할수가없어요 저번 게임패치 이후 괜찮다가 다시 갤 s10 업데이트 패치이후 채팅 쓰기창 안보이고 이벤트 코너에서 클릭창이 안나옵니다 집혼석 레벨업시나 강화시에도 번쩍이면서 팅기구요 빠른 수정 부탁드립니다,별표 5개 만점에 3개를 받았습니다.,3
2019-05-25,요즘 화면이 깜빡이면서 자꾸 멈춰버리거나 꺼집니다. 폰 최신 업데이트 하고부터 그런거 같긴한데...(노트9) 이거 좀 해결해주세요~,별표 5개 만점에 4개를 받았습니다.,4
2019-05-09,엘리스의 꿈 못하겟음 투력낫고 레벨 낫으면 걍 고렙들 다나가버리고 뭐 하지말라는건지 이헤못하겥음 이것도 상 중 하 이러게 헤주세 여 아주 하지말라는거네 투력 400만아님 겜하지말라는건가 두시간 가까위헤받는데 던전 초입에서 다죽던가 아님 시작하자마자 고렙들은 다나가버리고 겜하라는건지 말라는건지 모르겥음,별표 5개 만점에 2개를 받았습니다.,2
2019-05-25,"진짜 너무한거 아닙니까? s10사용자는 패치 될때마다 게임을 못하나요? 내돈들어서 33,000 0원 결제해서 매일보상도 못하고 보상은 누가해줍니까? 패치가 안되서 보상안못받는 부분만 답변주세요!! 쓸데없는 답변 달지말고 디온서버 코딱지 입니다.",별표 5개 만점에 1개를 받았습니다.,1
2019-04-30,접속이 밤 12시쯤인데도 대기로 10분이 넘게 기다려야하나요? 이럴거면 뭐하러 통합했는데? 기다려도 답 없네ㅋㅋㅋ 삭제,별표 5개 만점에 1개를 받았습니다.,1
2019-04-29,접속자체가안돼네요ㅜ 몇일동안계속접속해볼라고했는데ㅜ 계속튕기네요 거이반나절동안무엇을하셨나요? 정검을왜하셨는지ㅡㅡ 더이상해졌네요,별표 5개 만점에 1개를 받았습니다.,1
2019-05-01,아니 겜 은 너무 재밌는데요..... 특히 본캐만 들어갈려하면은 화면 엄청 깜박이다가 팅기는데 소리민들리고 이거 개선해야하는문제아닌가요?? 뭐라도 해주던가 진짜 찾아가서 행패 부려요? 출석체크 이것때문에 못받으면 손해 책임지실건가요? 하루빨리 댓글다세요 당장!,별표 5개 만점에 5개를 받았습니다.,5
2019-04-26,점검을 몇날몇일씩 해야하는건가? 무슨 게임을 이따위로 만들어서 잘하던 사람들까지 접게만드냐ㅡ 이럴꺼면 점검을 한달에 한번만하던지ㅡ에라이,별표 5개 만점에 1개를 받았습니다.,1
2019-03-21,오랫만에 복귀해서 무기레벨 36에서 40으로 강화하고 화면전환하니 다시36이네요 돈은 돈대로 쓰고 재료도 다날리고 이러니 하다가 다들 접어버리지...ㅉㅉㅉ,별표 5개 만점에 1개를 받았습니다.,1
2019-03-29,아니 다른캐릭죽이지도 않고 채팅창에 누구한테 욕한번 안했는데 왜 운영정책에 위베된다고 접속이 안되죠 버그그딴건 알지도 모르고 이유라도 알려주던가 머하자는거임?게임결제 안하면 게임에서 위배되는건가요?무과금유저인데,별표 5개 만점에 1개를 받았습니다.,1
2019-05-06,"홍미노트5 사용, 게임 설치후 2,3분 간격으로 팅김, 로그아웃되지는 않으나 게임밖으로 사라져 자동사냥등 불가 합니다. 패치해주세요. 너무 자주 팅겨서 게임을 할 수가 없어요 ㅠㅠ 핸펀 이거저거 다 해봐도 안되고, 그낭 화면이 잠겨버리고 화면 밀어서 잠금해제 하면 다시 게임으로 들어가요",별표 5개 만점에 3개를 받았습니다.,3
2019-05-13,s10 5g유저인데 아이콘도 화면도 번쩍 번쩍 화면 바뀔땐 겹쳐보이기도하고 해상도가 안맞아 그런건지 확인 수정좀 부탁드립니다 눈이 아파요 ㅡㅡ,별표 5개 만점에 3개를 받았습니다.,3
2019-04-25,점검을 하루종일하고도 오픈시간에 접속도 안되고 업뎃하면 좋아지기는 개뿔 더 쓰레기 만들어놓고 운영 참 그지같이하네 별점 1개도 아깝다 이런데 누가 현질하냐,별표 5개 만점에 1개를 받았습니다.,1
2019-05-26,출시후 매일 리니지2레볼루션 했던 사람입니다. 5월23일 업데이트가 되고나서 몇일째 갤럭시s10 5g 기종으로 게임 패치가 안되서 접속을 못하네요 게임 하지 말라는건가요???,별표 5개 만점에 1개를 받았습니다.,1
2019-05-10,어이가 없는게 공카에도 글남기기 힘들고..(일부러 먹아둔건지) 지패드4에서 게임안된다고 고객센터에 메일 보냈는데 다시 깔라는 어이없는 복사글만 답변 받았다. 고객센터에 메일보낸놈이 그거 안해봤겠냐.. 이젠 욕먹기 싫으니 니들말 안듣고 11만원짜리 허접 케쉬템이나 팔겠다는뜻으로 밖에 안보인다. 지금 사람들 엄청 접는중... 게임은 괜찮은데 운영을 개떡 같이 하는중..,별표 5개 만점에 1개를 받았습니다.,1
2019-05-22,계속팅김 빨리 수정좀 해봐요 뭐좀 하려면 팅기고 지우고 다시 설치하고 몇번이나했는지 몰라요 고객센터에 문의하라는소리 집어치우고 와이파이 해서 하라는데 그럼 왜 모바일로 했냐 피씨게임으로 만들지 아씨 쓰다보니 더 열받네,별표 5개 만점에 1개를 받았습니다.,1
2019-05-03,괴물사냥이 안되요~ 수동이든 자동이든 죽이려고해도 괴물들이 안 죽여져요. 껐다가 다시 켜서해도 안되요~ 다른건 되는데 사냥만 안되요.,별표 5개 만점에 1개를 받았습니다.,1
2019-05-06,업데이트 하면 뭐하나요? 매번 한가지 할때마다 버벅 거리고 버그처럼 상태가 최악이고 재부팅을 몇번을 하는건지 던전하나하기도 힘드넹,별표 5개 만점에 1개를 받았습니다.,1
2019-03-19,"G7+ 사용자입니다.. 이번 패치후 방향키를 제외한 모든 인터페이스, 메뉴등이 화면에서 사라졌네요.. 삭제후 다시 설치 해봐도 똑같구요.. 일부 사용자들한테만 나타나는 증상같아요.. 살려주세요 ㅠㅠ",별표 5개 만점에 5개를 받았습니다.,5
2019-05-20,"이번패치이후 케릭터선택화면에서,케릭터선택후 시작버튼이 안눌러지고 뒤로가기버튼도 안눌러지는일이 종종 생기네요..홈키눌러서 나가서 강제종료후 다시접속하면 눌러지는데 체크좀부탁드립니다. 노트8 유저입니다",별표 5개 만점에 4개를 받았습니다.,4
2019-03-24,복귀이벤 한대서 오랜만에 들어갔는데 옛날에 쓰던 계정들 캐릭터 싹다 없어졌네요;; 혹시나 내가 잘못알았나 싶어서 옛날에 계정 서버랑 종족이름 적어놓은 메모장보고 찿아서 들어갔는데 캐릭 사라졌어요... 오랫동안 접은 유저는 복귀하지 말라는건가요ㅜㅜ,별표 5개 만점에 3개를 받았습니다.,3
2019-04-05,레벨업할때 물약주는거 좋아요 근데 나머지 경험치를 채울곳이 너무 없는듯해요 경험치 벌 곳을 마련해주시면 더 좋을거같아요 ~!,별표 5개 만점에 5개를 받았습니다.,5
2019-05-27,제가 소액결제안해서 환불좀 해달라니까 왜안해주시죠? 진짜 화나네; 제가 결제를 안했는데도 돈을 내야되나요? 환불해주세요,별표 5개 만점에 1개를 받았습니다.,1
2019-03-19,저 어제부터 다시 시작하는데 채팅창에 터치하면 키보드가 떠야되는데 안떠서 말을 못해요 어떻게 해야되죠?,별표 5개 만점에 3개를 받았습니다.,3
2019-03-31,안녕하세요 컴터에 다운할려구하는데요 계속 모든기기와 호환되는 앱이라고 나옵니다 어덯게 해야하나요?,별표 5개 만점에 5개를 받았습니다.,5
2019-05-17,인내력. 끈질김. 현질에 자신 있는분만 하세요..켈10 .한콘테츠당 한번팅김.뭘팔아묵을 머리만쓰지마시고.겜좀 원할하게 만드는데 머리좀쓰세요. 한쪽만쓰면짱구됩니다.이년넘게 변하는게 현질템 밖에없냐.,별표 5개 만점에 2개를 받았습니다.,2
2019-04-30,갤노트8 사용자입니다. 이번 업데이트후 미러링중 게임접속이 안됩니다. 스마트뷰를 실행중에 게임접속을 하면 오류경고가 뜨면서 실행이 안됩니다. 확인바랍니다.,별표 5개 만점에 2개를 받았습니다.,2
2019-04-26,4월19일업데이트가 왜~않돼지~~이제까지 겜한지가3년인데~s7은 잘돼는데~s10도않된다고 난리구만~업데이트신경잘써요~~,별표 5개 만점에 1개를 받았습니다.,1
2019-05-28,설명하신대로 하려고해도 캐릭터를 만들어야 할수있는데 아이디 자체가 없어서 똑같은 아이디로 만드니 만들어지네요ㅜㅜ그말은 아이디가 없어졌다는 말이겠죠?ㅜㅜ,별표 5개 만점에 1개를 받았습니다.,1
2019-04-28,업데이트 후로 계속 접속만 하면 갑자기 화면이 깜빡거리더니 나중에는 안켜지더니 결국에는 끊기는 데요 이것좀 해결해주세요.나머진 다 괜찮습니다.,별표 5개 만점에 2개를 받았습니다.,2
