time,review_txt,stars_txt,ratings
2018-06-18,"달빠들을 위한 유토피아. 아무리 팬심이 있다 할지라도 그래픽이나 게임성, 과금정책등은 도저히 쉴드 칠 수 없지만 당신이 페스나 월희, 공의경계, 마법사의 밤 등의 서브컬쳐에 환호했던 달빠라면 그 모든것을 커버가능할것입니다. 솔직히 달빠 아닌 분들에게는 양심적으로 다른게임 추천드립니다. 사족으로.. 요즘 제도성배기담으로 시끌시끌한데, 내용상으론 군국주의 찬양이나, 과거 일제를 연상캐하는 요소들(욱일기, 카미카제, 침략미화, 과거의 전쟁범죄 물타기 등)은 없는 것이 팩트. 오히려, 일본이 패전하는 원래데로의 역사를 만들기 위한 ...
전체 리뷰",별표 5개 만점에 5개를 받았습니다.,5
2018-06-08,"아니 계정이 몇번이 삭제되는겁니까? 잠깐 폰문제로 실수로 계정연동눌러서 페이스북에 초반에 2렙에서 접은 계정 들어가지더니 원래쓰던 계정이 사라졌어요 이거 복구해주싶쇼 제가 오늘까지 쓰던 닉넴 ""SHAYHOUSE"" 복구 안시키면 저 이거 되든안되는 페그오 고소할겁니다 지난번 계정도 삭제하고 들어가니까 삭제되있어서 고생해서 다시키웠는데 이따구로 계정관리하게 만드는게 어딨어요 최대한 빨리 제 계정 복구시켜주세요",별표 5개 만점에 5개를 받았습니다.,5
2018-06-17,당장 매출때문에 이벤트좀 앞당기지마라 좀 숨좀 쉬고 게임하자 거위 배가르지말고,별표 5개 만점에 4개를 받았습니다.,4
2018-06-13,"퍼블리셔가 게임에 애정 있다고 들어서 그래도 믿고 있었는데, 이렇게 배신당할 줄은 몰랐습니다. 양쪽으로 너무 실망해서 이젠 더 뭐라고 말해야 할지도 모르겠네요.",별표 5개 만점에 1개를 받았습니다.,1
2018-06-07,전쟁미화 1945년 정말 최악입니다 그동안 애정가지고했었는데 그동안 사용한돈 환불 부탁드려요,별표 5개 만점에 1개를 받았습니다.,1
2018-06-13,피드백 기다리고있었는데 계속 눈치보다 얼쿠 픽업 내놓는건 아니잖아요 유저들 무시하는건가요? 유저들 입장 대변해서 말해주고 조정하는게 퍼블리셔아닌가요? 여튼 진짜 실망했어요,별표 5개 만점에 1개를 받았습니다.,1
2018-06-06,재밌는 페그오... 이건게임이 아닌꿀잼도박ㅋㅋㅋㅋㅋㅋ,별표 5개 만점에 5개를 받았습니다.,5
2018-06-22,1945 이벤 다 해본결과 니들이 생각하는 우익관련 그ㅡ없이고 트짹이들이 지들 머리속에서 생각하는 상상의 나래란다? 페그오 퍼블리쉬하는 여러나라한테 국제적 망신 고만주고 그냥 얌전히 다물고 하면안되겠니? 아님 접든가 중국도 우익아니라고 다물고있는판에ㅡㅡ 근데 쿠얼픽업은 굳이 당길필요가있엇니 돈마블아?,별표 5개 만점에 4개를 받았습니다.,4
2018-06-07,접었다가 흑잔에 혹해서 다시 깔고 현질하고 ㅎㅎ 돈과 시간을 바쳤던 제가 바보같네요 ㅎㅎㅎㅎ,별표 5개 만점에 1개를 받았습니다.,1
2018-06-07,또또 하지도않는 불편러들 불타죠 제도성배기담이 우익이라는 뇌내망상 오지네,별표 5개 만점에 4개를 받았습니다.,4
2018-06-07,"이번에 일본 페그오에서.. 딜라에서 낸 이벤트는 단순 게임 컨텐츠로 넘어갈수 있는 문제가 아닙니다. 아직 생존자가 남아있고 제대로 마무리되지 않은 과거를 이벤트랍시고 운운하는건 어느부분이 잘못되었다고 세세하게 따지기 이전의 문제입니다. 다른 나라로 수출이되는 대형 게임 컨텐츠가 이런 논란이 있는 주제를 허용해서는 안된다고 생각하며 최소 넷마블에서 운영중인 한국서버에서만이라도 수입하지 않겠다는 자사의 확답의 말을 듣고싶습니다. 모쪼록 입장을 표명해주셨으면 합니다. 이미 소비한 금액을 뒤늦게 환불해달라 할 생각은 없으나 현재 논...
전체 리뷰",별표 5개 만점에 2개를 받았습니다.,2
2018-06-05,솔직히 이게임은 개창렬게임이니 미친운의 소유자가 아니면 추천 안해요,별표 5개 만점에 5개를 받았습니다.,5
2018-06-20,괜히 여기다가 똥글 싸지르지말고 접을거면 조용히 쳐 접어라 너 접는거 넷마블 눈도깜빡안한단다 ^,별표 5개 만점에 5개를 받았습니다.,5
2018-06-16,가챠 확률 쓰레기인것 빼고는 재밌어요. 재밌는 겜 들여와주셔서 감사합니다. 건승하세요.,별표 5개 만점에 5개를 받았습니다.,5
2018-06-07,제도성배기담 구다구다 시리즈 한그오에는 출시 안 할 거고 일본 전범미화에 동의하지 않는다고 하셈 이 정도 당연한 걸 안 하면 그게 한국인이냐??,별표 5개 만점에 1개를 받았습니다.,1
2018-06-09,애국자는 아니지만 아닌건 아닌거고 여기서 쉴드치는것들이 있네..ㅋㅋ 무엇보다 그냥 재미없어서 지움,별표 5개 만점에 1개를 받았습니다.,1
2018-06-24,아니 퍼블리셔면 국내 유저들의 입장정도는 전달 가능하지 않음? 얼쿠픽업은 왜 당겼어? 그럼 우리가 아이고 감사합니다 얼쿠빨리뽑을게요 이럴줄 알았어? 유저를 개돼지로 보는것도아니고 넷마블의 피드백을 원한게아니라 입장전달정도만 해달라는건데 그게 그렇게 어려워? 그리고 트짹이라고 난리치는 새끼들 니네 프사에 19금일러좀 내리고 오던가ㅠ 쪽팔리지도 않니?,별표 5개 만점에 1개를 받았습니다.,1
2018-06-10,원작 제도성배기담은 자국비판하는 개그물입니다. 일단 이벤트 시작고 난 뒤에 원작처럼 자국비판이 될지 아니면 논란대로 옹호가 될지 봅시다. 에초에 페그오 스토리가 잘못된 역사를 고치는 스토리가 중심입니다. 뭐 여성화에 대해서는 말 못함. 그리고 저도 역사왜곡은 싫어합니다.,별표 5개 만점에 4개를 받았습니다.,4
2018-06-15,"역사왜곡은 계속되고있는데1945년이 나오는거 부터가 잘못이지.. 그리고 구다구다도 애초에 나치와 손잡고 학살하던 일본군이 나치를 때려잡는다는게 말이나 되냐? 한마디로 미화지. 나치는 나쁜데 일본은 안나쁘다는. 진격거작가놈이 말한""나치와 일본은 다르다.""의 일본 죄 미화하는거랑 뭐가 다르냐. 부디 페그오 한국에서 망해라. 사람 학살하고 발뺌하는 일본 망해라.",별표 5개 만점에 1개를 받았습니다.,1
2018-06-12,이번 대처와 유저를 돈으로 아는 제작사와 퍼블리셔 운영진에 상당히 실망했고 정말 환멸나네요,별표 5개 만점에 1개를 받았습니다.,1
2018-06-05,업데이트 되었다길래 갤9 문제 해결했나했더니 여전하네요 언제부터 나온 말인데 아직까지 이러나요,별표 5개 만점에 3개를 받았습니다.,3
2018-06-07,넷마블은 1945 이벤트에 대해서 항의해주세요. 어떻게 그 해에 있었던 일을 게임소재로 쓰나요?,별표 5개 만점에 1개를 받았습니다.,1
2018-06-05,5성 서번트 확률이 1%인데 거의 보면 유저들 돈 뜯어낼려고 극한 확률로 게임을 만든거 같네,별표 5개 만점에 1개를 받았습니다.,1
2018-06-07,트페미 ㅃㅅ들 ㅋㅋㅋ 또또 뇌 없는소리하네,별표 5개 만점에 5개를 받았습니다.,5
2018-06-07,1945년 전쟁미화 장난하나요? 돈 환불해주세요. 우리가 바보인줄 아는지요? 이런 게임소비하게 어이없어서 내가 지른돈 당장 환불해주세요,별표 5개 만점에 1개를 받았습니다.,1
2018-06-13,트짹이들 팩트 없으니 페미식 우기기 시전했다~ 이말이야 트위터만큼 폐쇠적이고 반 사회적인 커뮤니티가 애국심 타령 하는거 보면 웃음밖에 안나온다~~ 이말이야 그리고 딜라이트가 한짓을 넷마블에 왜 따지냐~~ 이말이야 니들도 회사생활 하면서 상사가 잘못한거 너한테 따져서 어처구니 없었던적 많았을거 아니냐~ 이말이야 집구석에서 트위터질 하면서 냄비끓이듯 애국 조무사 짓 해서 회사 다닐 시간도 없는건 아닐거 아니냐~ 이말이야 방구석 냄비애국 하나만큼은 트짹 인생패배자 들이 제일이라~~ 이말이야,별표 5개 만점에 5개를 받았습니다.,5
2018-06-07,여태 할많하않으로 넘겼지만 더 넘길 이유도 할 이유도 없습니다. 다른 넷마블 게임을 하더라도 딜라이트 페그오는 접겠습니다. 수고하세요.,별표 5개 만점에 1개를 받았습니다.,1
2018-06-13,팩트) 1945때문에 게임접는 사람들은 이게임에 진짜로 과금하는 사람들의 과금 액의 50퍼센트도 안된다,별표 5개 만점에 5개를 받았습니다.,5
2018-06-05,젘ㅋㅋㅋ이거 오륜진모르겠는데 소환이 한번됬었던 서번트나 예장인경우 소환창 뒤에서 소환되요,별표 5개 만점에 4개를 받았습니다.,4
2018-06-08,좋아하던 게임이고 결제도 했었던 겜인대...이번 1945사태는 정말 아니네요...,별표 5개 만점에 1개를 받았습니다.,1
2018-06-06,일본 1945년을 배경으로 한 이벤트 항의해주세요,별표 5개 만점에 1개를 받았습니다.,1
2018-08-25,ㅋㅋ 병맛겜 게임삭제한지 10일정도 했다가 간만에 다시해볼까하고 다운받고 업뎃까지1시간투자했는데 누가병맛겜아니랄까봐 계정연동된거 다초기화됬네 ㅋㅋㅋ 뮤오리진보다 운영실력이 병맛이군 돈에 미친쌕이들 ㅋ 게임 바로삭제했다. 믿고 거른다 설치후 업뎃 1시간걸리는부분부터 걸러야했다.,별표 5개 만점에 1개를 받았습니다.,1
2018-06-08,지금 이상태 끝내는 방법 별사탕뿌리셈 ㅎ 어차피 애들은 개돼지임,별표 5개 만점에 5개를 받았습니다.,5
2018-06-14,이번 1945 이벤트 관련해서 넷마블이 공식적인 입장표명 하나 해주지 않은게 너무 실망스럽네요,별표 5개 만점에 1개를 받았습니다.,1
2018-06-13,"딜라랑 다른게 뭔지 모르겠고 역시 구로의 등대, 대표 블랙기업같이 운영하시네요^^!",별표 5개 만점에 1개를 받았습니다.,1
2018-06-16,킹갓겜 평생 충성충성^^7 제도성배기담까지 일그오 망하고 2년 뒤까지 한그오 화이팅!,별표 5개 만점에 5개를 받았습니다.,5
2018-06-24,팬심으로만 즐길수 있는 게임이네요. 음악이 뚝뚝 끊기는 것도 거슬리고 과금도 고가이고...,별표 5개 만점에 3개를 받았습니다.,3
2018-06-05,사운드 왜이리 깨지냐 갤9플인데도 깨지네 일안하나,별표 5개 만점에 3개를 받았습니다.,3
2018-06-14,갤럭시s9인데 업데이트 이후 음질이 이상해요. 쓰고보니 밑에분도 올리셨네요 ------------- 아니 한달이 다되가는데 아직도 안고쳐요??? 내가 이 겜에 쓴 돈이 플스 엑박 다 사고 한참 남을돈이야ㅡㅡ,별표 5개 만점에 1개를 받았습니다.,1
2018-06-06,1945전쟁을 소재로 하다뇨 일본에서 만든 게임이요~ 겜삭합니다;;;;;;;;;한국사람은 게임 안하는줄 아나진짜;;;;;이거 탈퇴는 어떻게 합니까?,별표 5개 만점에 1개를 받았습니다.,1
2018-06-07,한국미국에도 서비스하는 게임에 1945배경을 내다니 제정신인가? 돈벌더니 미쳤나보네,별표 5개 만점에 1개를 받았습니다.,1
2018-06-13,가상이니 괜찮다는 애들은 살인범이 아~내가 그래선 안됐던거야 미안 ㅇ. <! 하고 개그책내도 오케이할 수준의 지성이라는거겠죠 그게 딜라와 넷마블 수준이기도 하고요^^ 쪽팔려서 어디 게임 하겠습니까 나는 한국에 수출하기에 더 안그럴줄알았지 ㅎㅎ,별표 5개 만점에 1개를 받았습니다.,1
2018-06-09,1945를 소재로 쓴게 문제다? 이생각 하는것들은 대가리에 구멍이 뚫린건가 1945년 배경을소재로 쓴 다른게임도 엄청많은데 이걸 문제삼는다고? ㄷㄷ 내가 봣을땐 가챠망하고 이번논란을 이용해서 환불 받을려고 하는 것으로 밖에 안보인다,별표 5개 만점에 5개를 받았습니다.,5
2018-06-07,이 게임에 백만원은 썼는데 이번 일본 업데이트 때문에 환불받고 지울까 생각 중입니다 이건 너무 하잖아요,별표 5개 만점에 1개를 받았습니다.,1
2018-06-10,트짹놈들 진짜 머가리 빈거 오지게 티내고 다니네ㅋㅋㅋㅋ 아주 천리안이라도 달리셨나봐?,별표 5개 만점에 5개를 받았습니다.,5
2018-06-22,최악중 최악 오랜만에 들어갔는데 더 최악이 되어니있음.,별표 5개 만점에 1개를 받았습니다.,1
2018-06-07,2차 세계대전의 전범국가를 미화하는 게임을 플레이했다는 사실이 수치스럽습니다.,별표 5개 만점에 1개를 받았습니다.,1
2018-06-06,s9+소리깨지는거 빨리좀 고쳐주세요 ㅠㅠ,별표 5개 만점에 3개를 받았습니다.,3
2018-06-05,S9플러스 렉이심합니다 소리도계속끊기구요 업뎃부탁드립니다 업뎃후에도 개선되지않았네요.....,별표 5개 만점에 4개를 받았습니다.,4
2018-06-14,우리 언냐들 쿵쾅되는데 매출 순위는 올라가네,별표 5개 만점에 4개를 받았습니다.,4
2018-06-07,과금은 200만원이상 썼는데요. 이번 1945건 항의와 대처를 주지않는다면 더이상 할 마음이 없습니다. 넷마블 대처 부탁드립니다.,별표 5개 만점에 1개를 받았습니다.,1
2018-06-05,님들 그렇게불만이면 하지마셈 저 과금안하고도 5성 2개임 과금 안해도 할수있는겜이니까 뭐 싫다 뭐 싫다 하지마세요,별표 5개 만점에 5개를 받았습니다.,5
2018-06-14,제도성배기담 이벤트에대한 피드백과 입장문 부탁 드립니다.,별표 5개 만점에 1개를 받았습니다.,1
2018-06-12,난 이제 너희들 개돼지 안될련다. 퉷,별표 5개 만점에 1개를 받았습니다.,1
2018-06-17,돈많은 아저씨들만하세요ㅋㅋ 가챠값 감당안됨,별표 5개 만점에 1개를 받았습니다.,1
2018-06-12,언제는 일본향 짙은 이벤트는 안들여온다고 뭐라고 하더니 혼노지 앵밥 가지고 싶다고 난리쳐서 결국 들여오니까 지금은 그걸로 뭐라고하네.. 그리고 넷마블이 압박을 주라고 하는거 보고 어이가 없던게 넷마블이 뭐라고 해서 딜라에서 그거 뭐라고 할거같나요? 그냥 그럼 얘네 서비스 안주면 그만인 애들인데 뭐하러? 그리고 1945 진짜 민감한 소재고 본인도 정말 마음에 안드는데 일단 스토리 나오는거 보고 욕을 더할지 짜증은 나지만 넘길지 고민해보려고합니다 마지막으로 상정석 비싼건 인정합니다..,별표 5개 만점에 4개를 받았습니다.,4
2018-06-07,한국에 수출까지 해놓고 1945? 제정신들인지 모르겠네요 지웁니다,별표 5개 만점에 1개를 받았습니다.,1
2018-06-08,갤럭시s9+에서 소리끊김현상이 발생합니다,별표 5개 만점에 5개를 받았습니다.,5
2018-06-05,운 안 좋으면 리얼 암 걸리는걸 알고 설치하삼,별표 5개 만점에 3개를 받았습니다.,3
2018-06-19,트페미와 메갈을한번에 청소한갓게임 이게바로메갈청정게임이다ㅋㅋ,별표 5개 만점에 5개를 받았습니다.,5
2018-06-23,그 머냐 마슈의 근신하년2 번째 음성 번역이 순 엉터리 더군요 수정 부탁드립니다.,별표 5개 만점에 5개를 받았습니다.,5
2018-06-21,전투나 뽑기는 넘어가고. 소설 읽는 거 같아서 좋았슴.,별표 5개 만점에 5개를 받았습니다.,5
2018-06-26,5성이나4성드랍확률이라도올려주세요ㅠㅠ,별표 5개 만점에 2개를 받았습니다.,2
2018-06-11,오랜만에 다시 해보려고 하는데 이전에 하던 데이터는 어디로 간건지 없고 전혀 엉뚱한 데이터가 남아있네요. 이거 복구 가능한가요?,별표 5개 만점에 1개를 받았습니다.,1
2018-06-11,인증정보가 안뜬다고합니다. 데이터로도 사용해봤고 와이파이도 잘되고...왜그러죠??,별표 5개 만점에 2개를 받았습니다.,2
2018-06-11,처음할때는 아무것도 모르고 막막했이만 하다보니 점차알게되고 하기쉽고 재밌네요 이런게임 맘에쏙듭니다 최고예요,별표 5개 만점에 5개를 받았습니다.,5
2018-06-05,님들아 나 무과금인데 5성 6개 4성 11개임 이거 운 좋은거임?,별표 5개 만점에 5개를 받았습니다.,5
2018-06-26,제도성배기담 그거 배경만 1945고 나머지 전부 패러디에다가 자기네 군들 까는 내용이라서 별 상관 없는데 물타기처럼 까는 건 심하지 않나 싶네요. 커버를 치는 게 아니라 스토리를 보면 위안부나 이런 문제 안나오고 어느 타 게임과 비슷하게 나치나 일본군들이 적으로 나오고 그 두 조직의 야망을 막는 평범한 스토리인데 대체 어디서 어떻게 들어야 1945 논란이 터지는지 궁금할 따름입니다. 과대포장도 정도껏 하시죠.,별표 5개 만점에 5개를 받았습니다.,5
2018-06-05,현질 가능하면 하고 무과금이면 하지마세요,별표 5개 만점에 1개를 받았습니다.,1
2018-06-07,입장만이라도 분명허게 표명해주셨어도 좋았을텐데요,별표 5개 만점에 1개를 받았습니다.,1
2018-06-09,13일날 스토리 나오면 그때 판단하고 지금은 기다리자 제발... 멀쩡히 잘 하던 사람들 피해 주지 말고.....,별표 5개 만점에 5개를 받았습니다.,5
2018-06-11,넷마블 립서비스라도 해줄 줄 알았더니 돌아오는건 쿠얼 픽업 앞당기기 ㅋㅋㅋㅋ... 1945를 지적하는 유저들을 개돼지로 알고있네 .. 과금유저들 얼마나 남았는지 간이라도 보는건가요ㅋㅋㅋ,별표 5개 만점에 1개를 받았습니다.,1
2018-06-13,피드백이나 잘 좀 해봐라 진짜 넷마블 먹여살리는건 유저잖아,별표 5개 만점에 1개를 받았습니다.,1
2018-06-20,소환이 아쉽긴하지만.. 정말 재밌습니다 한번 해보시길,별표 5개 만점에 3개를 받았습니다.,3
2018-06-05,복귀 유저인데. 접기전에 있던 잔다르크랑 보라머리의 캐스터가 사라졌어요....확인 부탁드립니다 아마 과금했었을거에요,별표 5개 만점에 5개를 받았습니다.,5
2018-06-05,완벽한데 따로 놀거리가 있으면 좋겠다 미니게임같이 그리고 성정석도 좀 퍼주세영☆,별표 5개 만점에 5개를 받았습니다.,5
2018-06-08,내돈뱉어내 이건 인간적으로 아니지 이게뭐임,별표 5개 만점에 1개를 받았습니다.,1
2018-06-16,아니 일 좀 해달라고 요구하는데 그걸 씹는 넷마블도 참 대단하네 그죠? 200을 부었는데 환불 한 번 안 해주고 아주 호갱님 보듯 본다 그죠? 픽업 당기면 지갑 열 줄 알았다 그죠?,별표 5개 만점에 1개를 받았습니다.,1
2018-06-08,1945 전쟁미화 딜라이트겜 안해 환불해줘,별표 5개 만점에 1개를 받았습니다.,1
2018-06-28,캭퉤진짜 내가 이겜 좋아하는캐릭터뽑아놔서 하는거지 없었으면 바로지웠어 진짜 넷마블 실망이고 역사의식납작한애들이랑 행복하게잘살아^^,별표 5개 만점에 1개를 받았습니다.,1
2018-06-13,바라는 거 많지도 않았는데 유저 말 귓등으로도 안듣는단 거 잘 알았습니다,별표 5개 만점에 1개를 받았습니다.,1
2018-06-23,지갑은 가볍고 몸은 무거운 그녀들 ㅂㄷㅂㄷ 개꿀잼,별표 5개 만점에 5개를 받았습니다.,5
2018-07-27,수집욕구는강한데 돈이업따? 하지마세요 정신건강에해롭습니다 잇던없던 돈끌어 모아서 쓰게 되니..,별표 5개 만점에 1개를 받았습니다.,1
2018-06-12,스토리가 우익이든아니든 일본이깨지든 나치가 깨지든 그게 문제가아니고요~1945라는걸 게임내 2차창작요소로 소비한다는게 문제라구요~일본나치 핵맞는 엔딩이면 인정합니다~,별표 5개 만점에 1개를 받았습니다.,1
2018-06-07,전쟁미화 이벤트 항의부탁드립니다,별표 5개 만점에 1개를 받았습니다.,1
2018-06-11,망겜임 이거 하지 말고 곧 나올 영원한 7일의 도시 합시다 여기 돈 쓴 내가 등신이다,별표 5개 만점에 1개를 받았습니다.,1
2018-06-16,씹뜨억겜 물론 전 골수 달빱ㄴ다 충성 충성 ^^7,별표 5개 만점에 5개를 받았습니다.,5
2018-06-06,페제로 이벤트하다가 튕기는데... 폰은 갤럭시s8+입니다(세이버와 싸우고 성배에 대해서 말하는 도중에 튕겼어요),별표 5개 만점에 5개를 받았습니다.,5
2018-06-13,"일단 내 칼데아에 최애와 차애가 있으니까 삭제는 못하겠는데, 두 번 다시 현질 하는 일은 없다. 실망임.",별표 5개 만점에 1개를 받았습니다.,1
2018-06-19,차분하게 피드백 기다리고 있었는데 예전에 혼노지때는 본인들 발언 빠르게 철회하고 이벤트 열었으면서 이번에는 유저들 간보고 쿠얼 픽업 앞당겨서 얼마나 지를지 각재는 모습 정말 실망스럽습니다.,별표 5개 만점에 1개를 받았습니다.,1
2018-06-07,한국에다 팔아먹으면서 그런 이벤을 날리는건 한국장사 접는다는거지 잘가라ㅂㅂ,별표 5개 만점에 1개를 받았습니다.,1
2018-06-13,개돼지 취급 받는데 질린다,별표 5개 만점에 1개를 받았습니다.,1
2018-06-13,퍼블리셔의 대응이 정말로 실망스럽다,별표 5개 만점에 1개를 받았습니다.,1
2018-06-23,흑잔 쿠얼 호부랑 성정석 30개로 날로 먹었습니다 여러분 아직 이게임 할만 합니다 운만 좋다면.,별표 5개 만점에 4개를 받았습니다.,4
2018-06-14,호부로 계속 픽업 잘먹고있습니다 무과금유저로서 매우 기분좋고 앞으로도 잘부탁드립니다,별표 5개 만점에 5개를 받았습니다.,5
2018-06-07,"전범일본군미화 논란이 있던 이벤트를 국내유저들의 항의에도 불구 구태여 한국판에서까지 서비스하고 나치와 적대하는 일본군 등 역사왜곡으로 이어질 수 있는 민감한 소재를 전범국으로써의 반성과 자각없이 개그성 이벤트로 무책임하게 소비하고 서비스하는 일본 딜라이트 게임회사에 크게 분노합니다. 이에 항의하는 국내유저들의 의견을 일체 수렴하지 않고 묵살하는 행위는 역사왜곡 및 전범미화를 교묘히 시도하는 딜라이트의 태도에 동조하는 것과 같습니다. 전쟁피해국가인 한국에 문제가 되는 게임을 퍼블리싱하는 회사로서 책임을 다해주시기 바랍니다. 공식입장이...
전체 리뷰",별표 5개 만점에 1개를 받았습니다.,1
2018-06-13,너네도 딜라랑 똑같이 유저들을 개돼지로 보십니까?,별표 5개 만점에 1개를 받았습니다.,1
2018-06-13,인기캐 픽업 당겨서 앱 순위나 주머니사정 좀 나아지셨습니까^ㅁ^!!,별표 5개 만점에 1개를 받았습니다.,1
2018-06-13,픽업당기는 거 말곤 할줄 아는 게 진정 없습니까?,별표 5개 만점에 1개를 받았습니다.,1
2018-06-07,"전쟁미화 라니 있을 수도 없는 이야기 입니다. 2차 세계 대전 당시, 일본은 나치와 다를 것이 전혀 없었으며, 동시에 그들이 무력과 불법을 앞세워 강제로 침략하고 강점했던 것을 우리는 잘 알고, 그 역사와 그들이 한 행동들에 대해 비판하고 혐오하며, 절대 반복되어서는 안된다고 생각하고 있습니다. 2차 세계 대전의 대한 결과를 수긍하지 못하고 이를 뒤집으려는 주제의 게임 이벤트 라는 것은 결국 제작사의 올바르지 못한 역사 인식 관점이 보이며, 동시에 이들의 이러한 관점은 단순 게임으로 그치는 것이 아니라, 일본으로 인해 많은 상...
전체 리뷰",별표 5개 만점에 1개를 받았습니다.,1
2018-06-07,환불하고 아이디삭제나 해줘 형씨 딜라 이것들은 말로 해봐야 못알아들음,별표 5개 만점에 1개를 받았습니다.,1
2018-06-21,뽑기확률만 높히면 갓겜,별표 5개 만점에 4개를 받았습니다.,4
2018-06-05,영령소환확률좀 올려주세요,별표 5개 만점에 4개를 받았습니다.,4
2018-06-07,성배제도기담 항의 넣으세요,별표 5개 만점에 5개를 받았습니다.,5
2018-06-27,키즈츠쿠노가 사다메다토시테모 코코로와 마다 이로오 하나츠.... 오레와 세이기노 미카타니 나루!,별표 5개 만점에 5개를 받았습니다.,5
2018-06-05,가챠돌려도 잘 안나옴ㅠ.ㅠ,별표 5개 만점에 4개를 받았습니다.,4
2018-06-16,가챠 확률 좀 올리고 성장석 주는 거 좀 더 많이 주면.....,별표 5개 만점에 4개를 받았습니다.,4
2018-06-05,글씨가 깨지는데요 이거 찍어놧음..,별표 5개 만점에 3개를 받았습니다.,3
2018-06-13,"당신들에게 제대로 된 입장문, 피드백 받기 어렵네.",별표 5개 만점에 1개를 받았습니다.,1
2018-06-10,엉 엉 이스칸달좀 뽑게 해주세요..ㅠ,별표 5개 만점에 5개를 받았습니다.,5
2018-06-07,이번에 우익이벤트 때문에 접습니다 별1개도 아깝네요 정말,별표 5개 만점에 1개를 받았습니다.,1
